<?xml version="1.0" encoding="UTF-8"?>
<xsd:schema xmlns:xsd="http://www.w3.org/2001/XMLSchema"
            targetNamespace="http://xmlpowercorp"
            xmlns="http://xmlpowercorp"
            elementFormDefault="qualified">
    <xsd:element name="FPTAptech" type="FPTAptechType"/>

    <xsd:complexType name="FPTAptechType">
        <xsd:sequence>
            <xsd:element name="Student" type="StudentType" minOccurs="1" maxOccurs="unbounded"/>
        </xsd:sequence>
    </xsd:complexType>
    <xsd:complexType name="StudentType">
        <xsd:sequence>
            <xsd:element name="Name" type="NameType"/>
            <xsd:element name="Age">
                <xsd:simpleType>
                    <xsd:restriction base="xsd:integer">
                        <xsd:minInclusive value="14"/>
                    </xsd:restriction>
                </xsd:simpleType>
            </xsd:element>
        </xsd:sequence>
        <xsd:attribute name="Sex">
            <xsd:simpleType>
                <xsd:restriction base="xsd:string">
                    <xsd:pattern value="Male"/>
                    <xsd:pattern value="Female"/>
                    <xsd:pattern value="t"/>
                </xsd:restriction>
            </xsd:simpleType>
        </xsd:attribute>
    </xsd:complexType>
    <xsd:complexType name="NameType">
        <xsd:sequence>
            <xsd:element name="FName" type="xsd:string"/>
            <xsd:element name="LName" type="xsd:string"/>
        </xsd:sequence>
    </xsd:complexType>

</xsd:schema>