<?xml version="1.0" encoding="UTF-8"?>

<FPTAptech xmlns="http://xmlpowercorp"
           xmlns:xsi="http://www.w3.org/2001/XMLSchema-instance"
           xsi:schemaLocation="http://xmlpowercorp FPTAptech.xsd">
    <Student Sex="Female">
        <Name>
            <FName>Dinh</FName>
            <LName>Anh</LName>
        </Name>
        <Age>18</Age>
    </Student>
    <Student Sex="Female">
        <Name>
            <FName>Phan</FName>
            <LName>Tu</LName>
        </Name>
        <Age>22</Age>
    </Student>
    <Student Sex="Male">
        <Name>
            <FName>Kiet</FName>
            <LName>Do</LName>
        </Name>
        <Age>15</Age>
    </Student>
</FPTAptech>